<?xml version="1.0" encoding="utf-8" ?>

<!--
    This is the configuration file of the database.
    DBName is the database Name
    DBPath is the database file's path
    UserName and password are used to access the database
    Provider shoude be OLEDB or SQLDB or other providers inheirs from DBProvider
    MaxConn is the max connection number the database can provide at one time.
-->

<!DOCTYPE SundayMaker SYSTEM 'Config.dtd'>

<SundayMaker>
    <DBProvider Name='Information' TYPE='SQLDB' MaxConn='500'>
      <DBName>SSE</DBName>
      <DBPath>10.60.43.9</DBPath>
      <UserName>sse_information</UserName>
      <Password>helloworld</Password>
    </DBProvider>
  <DBProvider Name='BasicInfo' TYPE='SQLDB' MaxConn='500'>
    <DBName>SSE</DBName>
    <DBPath>10.60.43.9</DBPath>
    <UserName>sse_basicinfo</UserName>
    <Password>abcd</Password>
  </DBProvider>

  <DBProvider Name='Account' TYPE='SQLDB' MaxConn='500'>
    <DBName>SSE</DBName>
    <DBPath>10.60.43.9</DBPath>
    <UserName>sse_account</UserName>
    <Password>sayhello</Password>
  </DBProvider>

  <DBProvider Name='AlumnusRecord' TYPE='SQLDB' MaxConn='1000'>
    <DBName>SSE</DBName>
    <DBPath>10.60.43.9</DBPath>
    <UserName>sse_graduates</UserName>
    <Password>helloworld</Password>
  </DBProvider>

  <DBProvider Name='Teaching' TYPE='SQLDB' MaxConn='1000'>
    <DBName>SSE</DBName>
    <DBPath>10.60.43.9</DBPath>
    <UserName>sse_teacher</UserName>
    <Password>teacher</Password>
  </DBProvider>

  <DBProvider Name='LabCenter' TYPE='SQLDB' MaxConn='500'>
    <DBName>SSE</DBName>
    <DBPath>10.60.43.9</DBPath>
    <UserName>sse_labcenter</UserName>
    <Password>icore</Password>
  </DBProvider>

  <DBProvider Name='Engineering' TYPE='SQLDB' MaxConn='500'>
    <DBName>SSE</DBName>
    <DBPath>10.60.43.9</DBPath>
    <UserName>sse_mstudent</UserName>
    <Password>mstudent</Password>
  </DBProvider>






  <ConnectString TYPE='SQLDB'>Persist Security Info=True;Initial Catalog=</ConnectString>

    <ConnectString TYPE='OLEDB'>
        ConnectStringHere
    </ConnectString>

    <CacheReg>
        <Cache Id='ManuallyCache1'>
            <Name>TestCache</Name>
        </Cache>
    </CacheReg>

    <FileLocate MaxSize='5000' MaxCacheSize='100'>
        <Title>Log</Title>
        <Path>_System\Log.xml</Path>
    </FileLocate>

    <FileLocate MaxSize='1000' MaxCacheSize='200'>
        <Title>Error</Title>
        <Path>_System\Error.xml</Path>
    </FileLocate>
    
    <Page Code='404'>
        <Path>~\404.aspx</Path>
    </Page>
    <Page Code='500'>
        <Path>~\SystemError.aspx</Path>
    </Page>

</SundayMaker>
